{
  "$schema": "http://json-schema.org/draft-07/schema#",
  "title": "Shopify Theme Block Schema",
  "type": "object",
  "properties": {
    "type": {
      "type": "string"
    },
    "name": {
      "type": "string"
    },
    "limit": {
      "type": "integer"
    },
    "settings": {
      "$ref": "./settings.json"
    }
  },
  "required": [
    "type",
    "name"
  ],
  "additionalProperties": false
}